subreddit,post_title,post_content
Bitcoin,what moves crypto market apart from the speculators,   would like   know   there   anything that moves   crypto market  apart from the speculators   are cryptocurrencies and their prices  absolutely speculative
Bitcoin,help starting crypto business,  guys    interested   starting   crypto business  app   that would take small amounts   money from your account over time and then invest the money into your favourite crypto assets  similar   plum   the   but   crypto version   anyone   familiar with      looking for people who have coding knowledge   the crypto finance space   any one who could help   get started   you  interested please reach out via   cheers
Bitcoin,did jack dorsey confirm   deflect   taking btc for advertising ,  might just being stupid but watching the conference there  the moment elon asks dorsey about accepting bitcoin for advertisers and   can  tell what the response was   know   have read about twitter working   incorporating bitcoin lightning for micro payments but what about the big   money
Bitcoin,⚡ lightning thursday july   2021 explore the lightning network⚡,the lightning network     secondlayer solution   top   the bitcoin blockchain that enables quick cheap and scalable bitcoin payments here   the place   discuss and learn more about lightning ask your questions about lightning provide reviews feedback comparisons     apps services websites etc learn about new   features development apps link   good quality resources articles wikis etc resources  here     awesome list   resources compiled   jameson lopp    want   test out your lightning fire power tip the bitcoin devs    previous threads    restrictsr  includeover18  sortnew  all  lnbook getting closer towards being finished and can already   seen      lightning dedicated youtube channel    also there   the playlist   chaincode labs    lightning stores    learn more and talk about lightning right here    bitcoin  bitcoinbeginners  thelightningnetwork and the  bitcoin chat 
Bitcoin,will eth2 affect bitcoinbitcoin mining,  was thinking   buying   mining rig with   friend and   said that ethereum    will affect bitcoin how will     affected and what can   expect   happen thanks 
Bitcoin,‘people have been participating without comprehending the risks’   think   need   know how risky   investing   defi  ,       beginner switching over decentralized finance can   exaggerated but research   the primary tool that will   your savior just don’  follow anyone blindly   under the influence   other influencers  even though they have more access   resources billionaire investors are not immune   the risk   decentralized finance   defi some   the crypto community first assumed that this was the consequence     rogue pull   kind   scam when engineers abandon   project and flee with the investor  money  these accusations were refuted   iron finance  the project indicated     blog post that   bank run     panic sale and the token algorithmic code were responsible for the disaster  
Bitcoin,‘people have been participating without comprehending the risks’   think   need   know how risky investing   defi  ,       beginner switching over decentralized finance can   exaggerated but research   the primary tool that will   your savior just don’  follow anyone blindly   under the influence   other influencers  even though they have more access   resources billionaire investors are not immune   the risk   decentralized finance   defi some   the crypto community first assumed that this was the consequence     rogue pull   kind   scam when engineers abandon   project and flee with the investor  money  these accusations were refuted   iron finance  the project indicated     blog post that   bank run     panic sale and the token algorithmic code were responsible for the disaster     
Bitcoin,daily discussion july   2021,please utilize this sticky thread for all general bitcoin discussions   you see posts   the front page    bitcoinnew which are better suited for this daily discussion thread please help out   directing the     this thread instead thank you   you don  get   answer   your question you can try phrasing   differently   commenting again tomorrow join     the  bitcoin chatroom  please check the previous discussion thread  for unanswered questions
Bitcoin,tesla ceo elon musk   optimistic about btc again   the   word event and       little worried about his words,this   what musk said this capricious villain     the real biggest dealer    feel that musk’  statement   the meeting may have   consequence that needs     paid attention     took tesla and spacex’  corporate funds and personal assets   allocate   large amount   btc and did not complete the selloff     high level except for the part   the previous announcement and the cost   about the same       now and musk said that   will not sell   now and   may buy       continues   fall this statement may cause the capital market   suspect that these companies and individuals   musk may cause systemic risks due   the continued decline   btc prices the end may   the retreat   retail cover agencies
Bitcoin,another scam the scammer story,  saw how much you guys enjoyed this post    thought    share   experience   getting   scammer   send       token gift several months ago   full story     summary the scammer   impersonating the bitcoin rabbi but replaces the     rabbi with       supposedly can give you 10x   your investment     days   you join his tradinginvestment company   used the inspect element tool   the browser   create fake screenshots     bitcoin wallet   make him believe that   had several bitcoin   then used the same technique   create   fake conversation between   and another investment company   got him   believe this other company offered   token gift   new investors     sign   trust   eventually get the scammer   compete with this other fake company and send       token gift the scammers twitter handle   one letter off from the real bitcoin rabbi the scammer replaced the   with       after receiving the token gift   began replacing all   with   until   figured out what was going since       rabbi   also question him about the 7th commandment thou shall not steal
Bitcoin,where did   word conf come from   first place,elon   going around trying   hijack crypto jack   also trying     the same and “own” bitcoin and ark just goes wherever there’  hype and they think they can get money from does anybody know where this   word conference came from   first place     are just being puppets and this conference   something made     them for their own benefit
Bitcoin,need help with buying token,  new   this crypto world and   english   not   good     some one just tell   how   buy  noidea  token   pancakeswap and   there   who can talk   arabic that will   better 
Bitcoin, 069 unit bitcoin machines worth     million was destroyed   malaysia,   malaysia the road roller destroyed  069 unit bitcoin machines worth     million because its stole electricity       formatpng autowebp  3fc5e03e4d6774e5c509ed7f6d760f929cff911d   formatpng autowebp  5b9a62ec7ae830acb6460e932a99927820ca83a5
Bitcoin,  coinstatus down ,  guys can someone test and let   know    getting error 8574 any one else 
Bitcoin,sim swapped,today   believe   was sim swapped took   very expensive nap this morning woke       notifications one from   phone provider thanking   for coming   today for servicing   phone and wanted   rating the other notification being   coinbase password was changed now   did neither   these things     was sleeping but   haven’  been     phone store   months anyways   woke   about   mins after the notifications and immediately tried logging into   coinbase     success   preceded   lock   account but   fear damage was already done   requested   new password but the emails were never coming through until   later realized they were going     junk folder     already deleted     did fill   out and created   new password but now  ’  making   wait approximately   days   get any further into   account because   had locked   earlier   have 2fa but unfortunately   dumbass has   under the same email     coinbase account   they must   noticed that too looking for any tips here much appreciated
Bitcoin,top   altcoins let’  hear them and why,here’  mine     eth  1st quarter earnings was    billion that’  about 210x more than earnings from 1st qtr last year already   multi billion dollar company and growing fast   amp flexa  making huge partnerships shopify incomm citcom world resorts las vegas sponsoring new national lacross team from vegas ncr the pos system   walmart among many others   the process   major integration  binance listing probably inevitable    dot  oversold   current price around     wallet investor prediction for         supposedly they are over   accurate whatever that means
Bitcoin,beware   very “believable”scammers   lost  000 and feel like   total fool…,  was approached   linkedin     lady   los angeles   the name   daniella georgiana also went   sylvia looking back now  ’  clear   fell for what   had hoped and that was getting out   300000   out   pocket medical expenses due     negligent florida doctor who caused   life altering spinal cord injury fortunately   health came back and   was very lucky five years later but the doctor was never held accountable and   thought this was going       saving grace     went all   and saw   account just rise   value everyday   ’  never ever wish this upon anyone else and the best   can     warn everyone   anyone contacts you promising amazing returns don’  even engage   conversation they are masters   this the website was   which has now been taken down   course they were supposedly   bitcoin mining company and forex broker also under the name iamfxbrokercom    turns out this group   eastern european with ties   nigeria   ’    huge operation and   urge everyone   pause and don’  rush into any investment that sounds tempting  trust your gut   you have the slightest doubt you probably right    work   hard   earn   dollar and   can   lost     split second   preserve what you have and don’  let what happened     happen   you
Bitcoin,getting into bitcoin, ’  been trying   buy bitcoin anywhere that dosent require     because   don’  have one   the moment because  ’    minor   need   bucks   bitcoin   buy something and  ’  tried   find   good way   buy for almost two weeks and   haven’  had any luck   far   really need this because this     important purchase   anyone knows   way   buy bitcoin that dosent include paxful         exchange both have gotten   scammed please put     the comments   can also send   gift card   your choice   anyone who wants   send   bucks   bitcoin   the address below    agree   send first   you suspect     just really need this     anyone   down please let   know thanks   bc1qqcn07zcvts209meqs5uppyfwhps0uqpmkw9g50
Bitcoin,proud owner   23xx bitcoins nervous and excited   the same time  ,  only started investing   cryptos back   april 2021 around time when bitcoin was soaring due   this   only invested only   either shitcoins   alt coins     expected more growth there but courtesy   the recent dip and timing   well not   its lowest though  ’  now   proud owner    23xx bitcoin while  ’  super excited also   bit nervous   how things will   from here but can’  wait for the day when  ’  slowly keep buying the dips and have   whole coin wish   luck 
Bitcoin,how   invest 1000 dollars   crypto just turned  ,hey bitcoin community    you can gather from the title   just turned   and have accumulated   decent sum   money throughout   years   summer jobs and birthdays    been interested   crypto more specifically bitcoin for   few years now    have the fundamental knowledge   crypto but   looking   learn more   question was concerning what recommendations you all had   how   invest 1000 into various cryptocurrencies   was thinking about investing half into bitcoin and the rest into   few other currencies     not sure how far 1000 can get you   the realm   crypto but for the moment   believe this     good starting point    not     willing   invest more money after    have   better understanding   crypto  before   close off what would you guys say   the best crypto exchange for beginner use also   apologize   this was the wrong place   ask these questions many thanks   everyone that replies
Bitcoin,lightning question,     trying   get into lightning   set     phoenix wallet   chose receive funds then used   electrum wallet   scan the address the address shows     recipient with   little lightning icon but   won  let   put any amount   the amount box not sure        segwit issue   what any ideas thanks for any help
Bitcoin,anyone have   update   gemini credit card release,have been   the waiting list and have not heard anything for   while are they still going   release one
Bitcoin,are there any projects going   right now   make bitcoin dummy proof and more user friendly,  all know    too complicated right now for the average person especially the fact you lose all your bitcoin      sent   the wrong address just curious   there   any ongoing projects   help make   more user friendly
Bitcoin,bitcoin   stacks technology,  would like   know your opinion   the stacks coin and the technology behind     uses the bitcoin blockchain   settle transitions youtubers such   trader university believe     the future   defi and   blockchain developer reddit that       seems   love the potential   the stacks blockchain   just haven  heard many people talk about   and was wondering   you guys have even heard about   and     what are your thoughts
Bitcoin,lildurkcom  lil durk  bitcoin,lildurkcom lil durk  bitcoin
Bitcoin,anyone remember what site this   from,     formatpng autowebp  413cdb66d11bc27bc8d8267c89d665812b71036e does anyone remember   site with this interface   found this     bitcoin folder with the date   december 2017 any help would   appreciated
Bitcoin,shower thought   had about   potential source   energy for bitcoin mining,  basically   idea will combine things   watched     separate videos  you may want   watch them   well   you can get what    talking about here    about   minutes   watch time english isn    first language     may not   able   explain   ideas   clearly     would like   anyways first   watched this video billions   change official film   watch from        then   watched this video the deepest hole   the world and what    learned from   watch from            summarize the first video talks about sending graphene cables down into the earth     able   extract heat from below  the earth  surface the second video talks about the deepest hole   earth that goes down     and   gets   hot that they couldn  dig any further because the rocks began   act like plastic   there may not even     need   dig   new hole for energy when one already exists    think mining companies and bitcoin billionaires have enough money and resources   explore this idea  manufacturing 12km long graphene cables might   costly but      one time expense    think     can successfully mine bitcoin profitably over the long term then   does give them the incentive   try     don  have   science   engineering background   this may just     pipe dream and    sure someone more knowledgeable will totally debunk this idea
Bitcoin,defismart contracts   btc,good read   how smart contracts are possible   bitcoin  
Bitcoin,which   the best exchange for hong kong,      considering doing some operations   hong kong and   would like   know which exchanges people use      looking for something that accepts simple local bank transfers  how much   simple local bank transfers cost    tidebitcom  any good    looks like   has some very expensive fees   your answer please write   that you have sent hong kong dollars     exchange bought bitcoin using   limit order and then withdrew   from the exchange   order for your answer     valid have   nice day
Bitcoin,first came the bitcoin followed   the shitcoin and now there are shitcoins made out   bitcoin   think they deserve their own name   reduce the confusion ideas,shitbits bitshits
Bitcoin,  have   btc   the uphold wallet what   the best way   transfer btc     ledger nano   and with less fees,  have   btc   the uphold wallet what   the best way   transfer btc     ledger nano   and with less fees
Bitcoin,leader   otf  lil durk ask   anything,let    absolutely ham boys
Bitcoin, ´  little worried, ´  little worried about european regulation   crypto assets and prohibition   anonymous wallets for all what blockchain for freedom fights governments are accelerating the control   your freedom sad
Bitcoin,with current fud don  panic sell bitcoin  value will still     infinity   the long term here   why,during these times   see   lot   fud around and newbies are converting their sats back into usd because they fear   lose   all that’  unfortunate what are the reasons   this selloff they treat bitcoin like risky stocks get rich quick scheme   worst they don’  understand how basic economy works they have   idea that bitcoin changes everything and will transform our entire society for the better     result   wanted   emphasize once again why our world needs bitcoin and reassure everyone that its value   scheduled       infinity   the long term      will always want   have more than our neighbors since the early ages humans have always lived   societies   survive and evolve social mechanisms have bring the dominance question into the equation   order   establish our status among our society   want   have more money than others   show dominance not   long ago some guys found   new way   distinguish themselves from the masses even more their idea was   privately own businesses and make people work for them   they can keep all the profits     called capitalism and   still considered the best system nowadays    inflation makes rich richer while making poor poorer   interesting lever for our elites   keep earning more   infinite growth one way           let banks print new money which will   injected into the economy businesses will produce more people will have more money making owners wealthier however the more money   printed   support growth the bigger the money supply gets and the more prices   goods and services     this   inflation   wages don’  increase   the same level employees get less buying power over time making them poorer    deflation system will never   voted   elites remember governments and business owners will always want   save their privileged status stopping money printing would result   deflation which means that prices would   down and people stop buying why buying something today when   will   cheaper tomorrow   that point companies would   bankrupt and shareholders would lose their wealth you know understand how this   important for them   keep inflation running quite easy      banks simply have   lower loans apr   encourage people   take credits and buy stuffs    inflationary system has plenty   other negative effects inflation   also   endless nightmare banks   countries borrows money from central banks but their debts will never   paid back instead they take new debts   reimburse part   the old debts money printer will never stop this   actually getting worst over time last but not least inflation   not   sustainable system for our finite planet alwaysincreasing mass consumerism consumes always more energy and resources that are not abundant global warming and climate change will never slow down   itself     inflationist economy      your own bank with bitcoin and change the system   make things clear from the start bitcoin   our only hope   change the system you don’  know who   vote for   the next elections because you don’  trust them   bring   working solution just buy bitcoin and hold   this will   your best vote   have   real impact here are the   main reasons why bitcoin   the only viable solution    bitcoin   decentralized     not governed   anyone and has been designed   follow the exact same principles and will continue   deliver   promised forever algorithms embraces certainty     the opposite   humanbased government that can change rules every now and then   please their own bank account   bitcoin has   21m max supply this   the first time   history   are dealing with   asset that will always   absolutely finite not even gold and cannot   replicated less and less coin will   produced until 2140 making   the perfect deflationary asset without mentioning coins that will   lost forever     the opposite   central banks which are printing infinite fiat currencies   bitcoin   the most secured asset billions   successful transactions   date and millions   wallets without   single hack   date the more people join the more the network   strong and secured bitcoin   your secured property   opposed   current systems where banks are hacked every day and could collapse   take your gold   absolute necessity   bitcoin   the most liquid asset you are always   click away   send any amount   anyone   any time and anywhere   the world everyone can   its own bank without any government intervention   third party censorship   bitcoin   the perfect ledger blockchain technology keeps perfect track   every transaction that has ever happened you would rather buy your drugs with cash than buying them with bitcoin same principle with corrupted governments     lot   third countries    bitcoin     store   value asset above all   you have probably noticed and despite what   written   the bitcoin white paper   want you   treat bitcoin like   store   value asset first the currencycash feature   just the cherry   top the cake that satoshi offered     however   each bitcoin transaction   considered    taxable event   many countries this does not advocate for   currency usage the high transaction fees are also   challenge that will need     adressed there are layer  solutions like lightning network that will help   that matter    bitcoin   incentiving holders   think long term bitcoin being deflationary   encourages people   hold their sats   the long term nobody wants   sell their bitcoins into   weaker currency that   losing more value over time never compare the price     btc   usd this   pointless   usd price will     infinity because   infinite money printing this   why   btc will always   equal     btc   judge bitcoin’  value think instead   its usd market capitalization and compare     other scarce asset market caps bitcoin still has room   grow 10x its current price   have the same value   gold 100x   have the same   real estate   you consider that bitcoin   scarcer more secured and more liquid than these   assets   let you imagine how early   still are   hope this summary will help people   realize how important bitcoin   for our future     our escape gate     fair inclusive and sustainable world buy hold and spread the word around you and that’  all   have   say about that
Bitcoin,police stealing peoples money cars homes,  people were pulled over and only had btc wallets police could not seize   and call   excessive amounts   money because they would not know what was   them bitcoin makes   tough for crazy control laws and manipulation   its constantly bashed  
Bitcoin,just gifted     year old nephew some btc,  darling nephew just turned one yesterday decided   gift him   little btc and eth educated his parents about the importance   hodling   feel like   deserve the best uncle award lol
Bitcoin,the bword     the bitch   shit   bedword,nice interview folks lots   good points and interesting arguments decentralised finance   bitcoin   fast would     great mass adoption period imo
Bitcoin,unable   close account   lightning pool,  added about 150k sats   play around     pool   lightning terminal app   the gui even after hit close and refresh the page   shows account open      formatpng autowebp  3e3a6fd3cff930964f69ad1a0a7bbaa76f070c59 also tried closing from the cli    first ssh into umbrel  ssh umbrelumbrellocalmailtoumbrelumbrellocal    find the process       terminal docker      open the   docker docker exec   a5c33b1e0d57 binbash    close the pool account  pool accounts close traderkey pubkey satpervbyte   addr  bitcoin address but    getting this error pool open datapoolmainnettlscert   such file   directory even the command pool accounts list also gives the same above error pool open datapoolmainnettlscert   such file   directory
Bitcoin,was the market crash   months ago organic   artificial ,  hear   many people saying   was   “natural price correction” and while     true that prices were   fact inflated the price dip went way beyond what   “correction”   supposed     the market did   fact panic but   hypothesize that the initial shock was artificially created     bunch   whales dumping coins into the market   benefit from said shock and buy   later   much lower prices thus explaining the initial dump right before the crash   blame whales for many   the problems and flaws   the crypto market without them   lot   “price corrections” would   out   control     currently see along with many other problems that would simply disappear     least   mitigated the only good thing   got out   this market crash   that some companies finally started taking care   the whale wallet problem glad   finally see companies the likes   genesis pool banning whale wallets   their communities maybe other companies will soon follow suit and start putting some pressure   whale wallet action
Bitcoin,why   the halvening event not emphasized more,  seems like the halvening   pretty much the single most important event for bitcoin holdersusers how come this isn  something emphasized like 10x more especially   newcomers
