subreddit,post_title,post_content
Bitcoin,cryptos stolen from   youhodler wallet out   thin air,  july 7th 8000 worth   crypto    stolen from   youhodler wallet  withdrawals were made and strangly enough that there was   email notification for   something that normally would occur     turns out that the silent withdrawal occurred after   used   public diners wifi here   saudi arabia     devasted and angry   not know want     and who     after please any assistance would   greatly appreciated edit also what  strange   that   youhodler account has   security measures  passcode and google authentication day later   saw youhodler  was missing from the google 2fa account how   that even possible
Bitcoin,  are     near the end   the chinese communist government  ability   fud bitcoin,some elements within the chinese government have opened major short positions   bitcoin right before announcing major fud they have done this   least three times since 2013   think this last one   may will   the last effective one not only because people are catching     the scam but also because they have now driven out most miners from the country and banned all transactions this was perfectly timed with elon  flipflop elon was then immediately awarded   the chinese government where   had previously been struggling with red tape and bad press the only arrow the chinese communist party have left   their quiver     ban possession but that would   impossible   enforce and would only make the ccp appear weak the thing they fear the most due   their inability   effectively enforce     think   are     near the end   the chinese shortcryptothenfud scam
Bitcoin,how   teach high school kids, ’    high school teacher with     term elective that   can basically   anything “technology” related that   want  ’  like   add   unit   bitcoin and crypto   general   guess   already teach cryptology but only basic puzzles you can decrypt   hand   don’  have any background   tech   computer science   coding… but  ’  smarter than your average bear  anybody have ideas   what     how       resources   can use etc also would     possible for     create   currency for use   the classroom what goes into doing that and again   basically have the freedom     whatever   want   the suggestions are   just watch   video then fine  ’    where all   you take     think   would   pretty cool   actually teach them about crypto though any     students that know anything get maybe     their info from legit sources  thanks nerds
Bitcoin,splitting bitcoin,  have   question for the bitcoin community   understand the not your keys sentiment that being written   someone were   have   certain amount   bitcoinnot stating how much what are your thoughts   splitting that bitcoin between   nexocelcius account for purposes   interest and   ledger wallet   just having   all   the blockchain     guessing the sentiment will     should     the blockchain but   feel like    leaving money   the table   you aren  making   work for you ultimately the goal would     get enough   build   amount   borrow off     the future     not   cash   and leave the bitcoin whole what  everyone doing
Bitcoin,btc     global trade currency,what would hinder all transactions between foreign entities whether that     global shipping oil production and sales etc from being conducted   btc  besides the volatility  this seems like   logical step for anyone facing forex rates   massive scales and could also allow those organizations   stack
Bitcoin,will bitcoin ever soar pass 40k again before 2022,for some reason  ’  been stuck     gridlock between  38k   coin for months despite all the news   events surrounding its potential
Bitcoin,bitcoin network status update saturday july   2021,status   the bitcoin network     saturday july   2021       est total bitcoins  752808544971 height 690462 difficulty  363025673659960938 statistics for the past   hours number   blocks mined 156 total bitcoins output amount sent  238651834031 total fees  301951 average time until block found   minutes   seconds estimated hashrate 111382421079577469    current price   837  data provided   smartbitcom   price data provided   coinbasecom         bot   commands    cryptobot  message   creator   source code 
Bitcoin,what measure should   use   compare bitcoin blockchain   other pow blockchains,  want   compare relative security against   attack   two different pow blockchains    bitcoin   litecoin   there   particular kpimeasureyardstick   can look   and make sure that     comparing apples   apples  for instance   know that one cannot simply compare hashrates per second   bitcoin and litecoin because they use different hashing algorithms   the absence   that how     compare the two blockchains relative   each other    will   very grateful for any insights you guys could offer
Bitcoin,the intrinsic value   bitcoin,millionaire buys   million   bitcoin fbi seized 100 million from bitcoin wallet whale just bought 200 million   bitcoin why     many within the bitcoin community still describe bitcoin  value against the thing that many are buying bitcoin   avoid fiat the irony   that within   week   two   that title the  value has changed   much that the information   inaccurate anyway   bitcoin hodlers and adopters are serious about bitcoin being   better alternative   fiat then   also need   consistently report the bitcoins   satoshis even when helpful that are being bought invested etc   model the language that properly describes the real value   those transactions
Bitcoin,who says bitcoin has   utility,  regularly trade bitcoin options   ledgerx and the other day   needed some usd   close out some     short calls this being the first time   had   actually transfer usd into ledgerx     thought how hard could     well they only allow wires but even   they used plaid which   probably   the horizon   realized that wouldn  work for   because   credit union   not supported   know that from dealing with blockfi   really didn  want   bother with   wire and then   dawned     that   could just transfer bitcoin over and sell       fired   coinbase bought bitcoin sent       ledgerx wallet sold   and had cash   hand   close   positions all within   minutes   that  not revolutionary   don  know what  
Bitcoin,how can bitcoin become fungible, ’  been   bitcoin advocate since  ’ and accumulating for years the only real issue   see with bitcoin     whole    ’  fungibility  how       about removing the ‘past’   bitcoin transactions let’  say your bitcoin goes through drug lord   stripper   gas station   gas station employee   you how   you remove that   ever was   possession   the ‘drug lord’  this     issue because   are already seeing some companies ban certain coins from addresses that were associated with the silk road etc  yes you could make   argument that cash   traceable but     much harder     and tedious and not nearly   accurate  this   just   discussion thread    ’  completely wrong please explain thanks 
Bitcoin,  all hope   finds   ,  good news story   the making one   the few niggles   have    ’    little too easy   lose   someone finding his lost treasure would   great news  
Bitcoin,does whoever finds the correct hash get all   the block reward,      split proportionally between all the people who worked   the block  also how can   btc transaction take seconds     through when   block   found   average every   minutes surely the transaction should only   through once the block   found with the transaction inside  
Bitcoin,where can   buy bitcoin   bulk,not buying them   invest but   use     alternative currency   there  any trusted seller you know please let   know
Bitcoin,btc   ndau,why are goldman sachs and morgan stanley suggesting ndau   going     the next bitcoin goldman sachs implied purchasing ndau bitcoin     way higher price and seems     doing better   don’  get   thought
Bitcoin,winklevos and the blocksize war,was wondering where did the winklevoss twins stood   the blocksize wars
Bitcoin,lazer eyes  the sovereign individual,  2020   roughly   centuries after martin luther nailed his   subversive thesis   the church door   whittenburg the perception   the costbenefit ratios   citizenship will have undergone   similar subversive clarification the vision   the nationstate among persons   ability and wealth the  sovereign individuals   the future will have undergone the political equivalent   lazer surgery they will   seeing 2020 from the sovereign individual mastering the transition   the information age written   1997   james dale davidson and william rees mogg these geniuses predicted bitcoin and lazereye memes   years ago
Bitcoin,the hodler,  bought bitcoin when   was magic internet money   bought when all about   said   was   ponzi and bought when the bankers told   that criminals used     launder money      bought   2011 2013 2015 2017 and   never stopped buying   bought the dip  and bought the dip when   dipped again and again      bought the fear   bought the panic   made   market with conviction   wasn  sporadic      bought when there was blood   the streets    bought when the blood was   own   doubled down when the blood was   own      bought when barclays hsbc and santander tried   stop     simply used   ziglu money  ’  keep hodl’ing and   won’  stop   you try   stop   you  ’  buy the top     you see   won’  stop hodling because hodling     lot how can you not hodl when you know what you’  got
Bitcoin,best ios wallet,what’  the best ios software wallet  ’  comparing brd trust wallet exodus and coinbase software wallet the one where you control the keys which one   these   any others out there   best software ios wallet
Bitcoin,investments plans,invest 200   earn  500 invest 300   earn  500 invest 400   earn  500 invest 500   earn  500 invest 600   earn  500 invest 700   earn  500 invest 800   earn  500 invest 900   earn  500     hours               maximum amount invest 1000   earn 12000 invest 2000   earn 23000 invest 3000   earn 34000 invest 4000   earn 45000 invest 5000   earn 56000     hours                   gold plan invest 1btc   earn 10btc invest 2btc   earn 20btc invest 3btc   earn 30btc invest 4btc   earn 40btc invest 5btc   earn  50btc invest 6btc earn 60btc invest 7btc earn 70btc invest 8btc earn 80btc invest 9btc earn 90btc invest 10btc earn 100btc invest 11btc earn  200btc invest 12btc earn 300btc invest 13btc earn 400btc invest 14btc earn 500btc invest 15btc earn 600btc invest 16btc earn 700btc invest 17btc earn 800btc invest 18btc earn 900btc invest 19btc earn 1000btc invest 20btc earn 2000btc     hours
Bitcoin,are     for another leg down,  would start   saying       expert but   notice bearish pressure has slowed down and are just moving sideways but bulls are still very much weak and are finding   hard   push price back     know     only   matter   time until fundamentals take over and push price   but   the current levels   not hold what     store for  
Bitcoin,avaxbtccom legit,hello   wanted   ask you   avaxbtccom was legit
Bitcoin, ’    happy   pay taxes   you could pay   crypto,like   governments would implement crypto taxes     way that      the amount     coin you have instead   the value which   unfair because crypto   volatile   then   don’  think the avarage holder will care   much governments always pretend people use crypto just for tax evasion but don’  make   easy   pay taxes   crypto like who are they trying   fool
Bitcoin,  just sold   btc for the first time only   get   tax write off   bought   right back,the nice tax loophole where   can write off   crypto losses   awesome   recommend any small business   1099 workers who are currently     lose sell create   taxable event then buy back
Bitcoin,cara delevingne  mine has just sold for 18000 stx this   the first sale for this   number one and another first for the stacks network and for bitcoin,cara delevingne  mine has just sold for 18000 stx   this   the first sale for this   number one and another first for the network  
Bitcoin,taxation   bitcoin mining    gold mining,    now bitcoin miners need   pay tax   the market value   coins mined based   the market price   the minute the coins are mined this   different from gold mining where gold miners only pay taxes when the gold   sold for dollars this   also different from farming where farmers pay tax only when the crops are sold for dollars anyone knows why the discrepancy
Bitcoin,btc going parabolic bull run,looks like btc daily chart   going parabolic bull run next    
Bitcoin,     pro   this,   not   financial advisor but based   this chart   will either     down   sideways     advice you   buy sell   just hold your coins    just follow this advice and you may   may not become   millionaire within   monthyeardecade
Bitcoin,sweeping paper wallets,   got some paper wallets which   created back   2014 when they where cool    just wondering what app   software   considered the safest way   sweep these wallets onto   trezor hardware wallets  thanks
Bitcoin,the inventor   most likely,    can agree that wright   not the founder then   must   hal finney because only then wright can   sure   make claims that     which     most certainly not wright knew finney and wright could not take the risk otherwise this means two things   the initial blocks will never   recovered and bitcoin   even more scarce than the supply numbers show   wright needs     stopped   the community with all means possible especially looking into where wright was   every moment satoshi made   posteditsubmission
Bitcoin,answers   bitcoin has   intrinsic value government ban environmental impact etc,endthefudorg has the best articles   all   these misinformed questions that have been asked   nauseum   feel free   point out   this website   yet another noob asks the same old questions
Bitcoin,can they technically ban bitcoin    usa,        usa decides   ban bitcoin because they cant have control over       even possible can they prove   you have used bitcoin     you have bitcoin can they shut down crypto wallets   you are not able   hold  
Bitcoin,unloading   bank accounts   places like coinbase,    have never done   but   have heard and   have doubts about how banks   general approach this phenomena two questions     have more than 650k that   want   convert   btc and   have these checkingswellsfargo chime bbva   unkown credit union which bank not just among   accounts   more liberal about btc exchanges and what exchange   the most compliant with   regulations aside from coinbase and can they freeze your accounts when they see you  converting your money   btc what  the workaround remember   just want   this once   can   buy btc with   credit cards too
Bitcoin,got hacked   2017 lost   btc  never reported   but out   morbid curiousity,    give you the transaction ids could anyone possibly tell   where   ended  
Bitcoin,microsoft using bitcoin   allow people protect their digital identity,microstrategy ceo michael saylor has released microsoft  plan   build   project that will assist average people protect their digital identity using bitcoin microsoft   working   ion project that builds decentralized identifiers dids which will give people the right   own and protect their privacy   the internet all these are     built   top   the bitcoin blockchain where people will have   secured cloud space   store all elements   their digital identity
Bitcoin,apple  founder steve wozniak describes bitcoin     “miracle”,apple  founder steve wozniak reportedly describes bitcoin   “the most amazing mathematical miracle” during the jalisco talent land digital 2021 event techsavvy wozniak believes that the bitcoin   more precious than gold because gold   not very scarce because people keep discovering gold and   believes one day   will   reproducible   factories wozniak has always supported bitcoin over the years
Bitcoin,let  get together and fund     hour cable news channel dedicated   crypto,serious question what would this take   create   cnbc   crypto
Bitcoin,yet another crypto scammer georgethomas21,with   account over half year old   wary      formatpng autowebp  ce40045288bebc26a8089f42ca1624648bfea576   formatpng autowebp  5928a5b496b41650e673e8e8b0e681589a97760b
Bitcoin, ’  official, ’  switched from paying hookers   fiat   bitcoin cheers   the weeknd 
Bitcoin,  are   the accumulation phase,the fact that bitcoin has been trading sideways shows how much demand there   for bitcoin   these prices otherwise shorts and liquidations would have driven   much lower sell pressure   drying   slowly and   the meantime long term holders are accumulating from paper hands for example this address     currently has over 100k btc and you can see they have been accumulating coins for the past   months there   also   chain data that suggests the same that long term holders are accumulating   the same time short term holders are selling   ’  likely   will trade sideways for the next    months but this   honestly   great time   accumulate btc price   already pretty low and the risk reward suggests  ’  not worth risking     over    price difference
Bitcoin,stacking sats for   months straight  status update,been stacking since oct 2017 was broke   the time   savings started   put 500€ per month into bitcoin   update this blog   keep track how good     savings strategy bitcoin   currently almost   years   not gonna stop anytime soon hopefully you find this motivating and start   stack the best you can yes   know don  tell how much bitcoin you own kinda dumb         this but necessary     wanna tell this story enjoy     
Bitcoin,  you are reading this there       chance you are missing out   free crypto,recently   read   statistic that     all users who earned karma this month   not have their vaults opened   those who have not yet opened their vaults please click this reddit link explaining what they are        own words vaults are reddit’  cryptocurrency wallets which store tokens you can earn   participating   this subreddit   our case these tokens would   moons moons are currently      each and all   takes     karma   earn one moon this distribution   you haven’  opened your vault yet you are literally missing out   free money and   those who   have their vaults open congratulations you are   the top     all people   this subreddit     million subscribers that’  right less than 100000 members   total have opened their vaults and   you’  stacking moons then you’  ahead   the game
Bitcoin,fiat savings   bitcoin,  was looking over   fiat savings earlier and   only just occurred       never counted   bitcoin   fiat they say don  invest more than you are willing   loose but     head that fiat   already gone    holding long term fuck fiat
Bitcoin,daily discussion july   2021,please utilize this sticky thread for all general bitcoin discussions   you see posts   the front page    bitcoinnew which are better suited for this daily discussion thread please help out   directing the     this thread instead thank you   you don  get   answer   your question you can try phrasing   differently   commenting again tomorrow join     the  bitcoin chatroom  please check the previous discussion thread  for unanswered questions
Bitcoin,should   use coinbase,hello should   use coinbase over exodus   only plan   sending and receiving and   heard them having low    fees   never plan   buying  selling crypto because   under   can   still use the service without   for just sending and receiving    debating wether   not   should put 100000   there and use       main wallet main concern     getting locked   some   but     use   for sending and receiving only should     fine    thank you
Bitcoin,  youtuber says   friend   his borrowed  000   buy one bitcoin and now       000,look        see his claim    1019s   1019s
Bitcoin,looking for   good source for mining hardware,     new   mining and looking into something used   came across two different sources selling refurbished s19 pro miners     suspiciously low price         are these legitimate sources for mining hardware   not feel free   call     noob and point     the right direction   terms   sources for hardware much appreciated   advance
Bitcoin,what   the advantage   bitcoin,simple question let  say    living   like oregon why should     town government   state government     national government use bitcoin instead   usd  most people throw out buzzwords like decentralized and online ledger but   don  understand what benefits these actually provide     someone could let   know that would   great thanks
Bitcoin,any one mining with canaan avalon 920,  need opinion about canaan abalon 920 and avalon 851
Bitcoin,makes   angry,every time   visit the butters reddit   feel   mixture   both laughter and deep sadness   the people that inhabit  
Bitcoin,for all those shitting   ion     kneejerk reaction just because      microsoft  project please check   out first      top   bitcoin   will help      open public permissionless and decentralized,almost all the comments   this post were negative here    bitcoin   looks that most people commented without even watching the video   reading about ion this   the post with the video   direct link   the video   this   ion  website     ion     layer   open public permissionless decentralized   network based   the purely deterministic sidetree protocol which requires   special tokens trusted validators   additional consensus mechanisms the linear progression   bitcoin  timechain   all that  required for its operation
Bitcoin,just got involved,just got   and   love  …but wtf just got involved   couple months ago and   super stoked       part   this feel like  ’    revolution   sorts anywho got some coin being proactive doing   own research buying this big ass dip dca’ing getting btc getting even more eth because you know  ’  better  don’  really fuck with alts but got   little algo and about  000 ankr that   feel pretty good about   just like   their web site   tits and they got   good program going   fuck you but yeah long story short   got   ledger and tried the whole “buy shit directly from your wallet shit and they use wyre      did   ach withdrawal from   bank   get some btc that was last friday they were super excited   take   money from   bank account but here   are   week later and   btc…not     wallet not     ledger live   this normal like hell  ’  gunna just use coinbase next time cause this   some bullshit
Bitcoin,how would one   about figuring out     deceased person   brother bought bitcoin,  everyone   was wondering   any   bitcoin folk would know what the most common platform  one might have purchased bitcoin   between the year 20092012    recently gotten into cryptocurrency and made   first couple   investments   etoro   suddenly occurred     that bitcoin would have been just the kind   thing   brother would have been into   was   avid redditor and loved new inventions tech and futurology   general     could really see him buying   few bitcoin back   the day   see where   would   here  the problem   brother passed away very suddenly   2012 from   undiagnosed heart condition   was only   years old and had just graduated cum laude with   degree   mechanical engineering   days before   died   know   parents still have his old macbook and   recall that   were able   access his password keychain function   the past    pretty sure   can log into his email which would   the first place   would look any tips for keywords websites   company names   should look for   this little scavenger hunt   general ideas about how one would   about retrieving such information      wind   finding and gaining access   bitcoin   bought    going   make   sizeable donation   the heart foundation and then split the rest between   parents and siblings
Bitcoin,the more time   spend   this subreddit and   research…,  realize more and more that   btc    btc   have heard   btc    btc many times before here but   never fully understood until now the light clicked for   fiat   volatile compared   btc not the other way around just wanted   share   thought thanks for reading   you’  got this far
Bitcoin,how does one become   bitcoin maxi,for people who were   ahead   the curve   detect bitcoin     promising asset and tech how     that bitcoin maxis don  recognize that same potential   legit promising altcoins
Bitcoin,what   the future   bitcoin after eth2 ,    most   you are aware eth      going   launch soon     btc supporter   just   concerned about btc since what ever btc qualities has eth2 has   much better except for the scarcity   what   you think will happen   bitcoin after the release   eth   
Bitcoin,    have any other alternatives,     27years old and have enough cash   purchase roughly    btc the issue    facing   that   live   the caribbean trinidad after using the link   the sidebar for worldwide trading   seems that   only have one option   purchase btc coinmama this platform apparently has the highest fees when buying         beginner   this entire btc world   just trying   buy some coins   hold     for the next    years any alternative paths       just have   suck     and pay the hefty fees
Bitcoin,  brand new way   generate website traffic,      just joined traffic   bar which     brand new free way   generate website traffic for your websites unlike many other services traffic   bar uses   level ladder which generates hits for members   using the daily update email but the reason that   joined more than any other was that   can use the traffic   bar   advertise   website completely free and reach almost everyone   the internet click below   find more   kind regards
