subreddit,post_title,post_content
Bitcoin,    minutes really that bad,  was   member     online appbased bank for   years   loved them then they were bought out     new bank and the old bank accounts were converted over and the old app was eol’  the new   bank and their app sucks imo     decided   switch     different   bank   opened     account with said different   bank   the beginning   the month   week later   started the transfer   bank   headquartered   alabama and   bank    ’    michigan   thought transferring   money would   easy but immediately   had problems bank   had    000day limit   ach push money     external bank but luckily   bank has   limit   ach pull money into   account     friday morning   10am   tried   initiate   transfer     funds from       but   could not select the current friday   initiate the transfer   had   choose the following monday   initiate the transfer   monday the funds disappeared from     bank account and   received confirmation   the funds       bank   the next thursday this whole process too   week   realize waiting         minutes   get into the next few blocks can   frustrating and people bemoan their transactions taking   long when   just want   click   button and have instant confirmation but   just had   wait   full week   move all   checkingsavings     dollar currency from one bank account   another given the alternative that   pay   onetime fee and get   the same day   think bitcoin isn’  that bad
Bitcoin,bitcoin longest chain and outpacing the attackers,  have been rereading through nakamoto’  white paper again   focus for now     the abstract     also rereading   see   nakamoto ever mentions “blockchain”   how the concept   developed   the paper   have rolled   sleeves   several times   working   get   head around bitcoin and crypto   general   struck   this morning     was reading that   isn’  just the outpacing   the attackers but the other security mechanism   the length   the chain   the cooperative nodes     working   trying   create   accurate visual portrait   bitcoin   breaking     into its smaller systems     read and think through the currency   get   mental image from the various concepts and   try   capture them while   can see       mind’  eye hopefully   will   able   sew all the elements together into   coherent portrait   some point   like baking   nakamoto’  abstract because     the essence     concentrated form
Bitcoin,  this true can     debunked,saw this   another sub would like   hear some truth about   core has rigged the game the same way legacy has   instituting   fee market with the blocksize cap they have effectively gamed the network       positive feedback loop   ⁠⁠create fee market institute blocksize cap had nothing     with tech capabilities really   ⁠⁠fee market creates competition for transactions thus increasing the price   fees   ⁠⁠higher fees ensures hashpower   desired chain   ⁠⁠higher hashpower  more security investors will always choose highest security   store value hence the store   value narrative and the hodl narrative that decreases liquidity   ⁠⁠more money flows into core chain and causes fees   scale   with   therefore creating the positive feedback loop   rising fees and investment   you follow this logic   its end   will cause core chain   become   expensive   spend   that only the largest institutions governments and central banks capable   using   sound familiar right then another transactional layer fedcoin       red herring instituted for plebs   use that will   fully transparent and controllable   you aren  using your money     approved manner you are disciplined like chinas sesame credit   the usg and any other entity that has the access edit   should also mention that   have   suspicion that the chinese miners were spamming the network   force legit transaction   carry fees this would mean the miners are incentivized   not act   the best interest   the network     whole   all   the core model   fundamentally broken   the fee market
Bitcoin,bitcoin network status update sunday july   2021,status   the bitcoin network     sunday july   2021       est total bitcoins  759902294971 height 691597 difficulty  854532277091080078 statistics for the past   hours number   blocks mined 148 total bitcoins output amount sent  430416250831 total fees  211214 average time until block found   minutes   seconds estimated hashrate 101929455115681610    current price   367  data provided   smartbitcom   price data provided   coinbasecom         bot   commands    cryptobot  message   creator   source code 
Bitcoin,indonesia will have   print more money   fix this brrrrrrrrrrrrrrrrrrrrrr, indonesian rupiah will see hyperinflation   formatpng autowebp  29a5fdcf6b280a89476e45d275c5043765252858
Bitcoin,nft,   think nft  are pretty much useless
Bitcoin,  question   have   ask are   witness that josph schumpert  idea   “creative destruction”   valid and   blockchain technology makes our traditional banking system obsolete,     name that should not   missing when   talk about today  finance world   joseph schumpert who was through and through fascist   shaped many generations   economists bankers and related investment strategies one often hears the name karl marx   adam smith but for the conservative financial world schumpert  main work which   based   marx  ideas capitalism socialism and democracy first published   1942 laid one   the cornerstones   today  financial world with the crazy idea   “​​creative destruction” –    process   industrial mutation that continuously revolutionizes the economic structure from within incessantly destroying the old one incessantly creating   new one the book   much more than   prognosis   capitalism’  future     also   overambitious defense   capitalism   the grounds that capitalism sparks entrepreneurship     the third most cited book   the social sciences published before 1950 behind marx  capital and the wealth   nations   adam smith currently   google scholar     top     cited economic researcher even schumpert was   crazy bastard   his ideas about how capitalism   and should   organised   our society   believed that capitalism would   destroyed   its successes     starts   his prologue “can capitalism survive       not think   can    come back   the crypto world   question   will and can blockchain technology change our economic system     fair spread   wealth   this world     fetch and carry capitalism     have   now   dont know guys and girls…
Bitcoin,any tech guys out there who can explain jack dorseys ‘square’ defi plan,  that building   2nd layer   btc does this type   stuff need    consensus       just layers built   the network has defi been built   btc before any info would   helpful for     understand this process
Bitcoin,wife asked for sell 1btc   32400 yesterday   said     will     33000 but,yesterday   wife want   sell   btc   price 32400   said   but today when   woke   the fact     ironic
Bitcoin,what will happen,  just want   ask   michael   saylor sell all   the bitcoins  his company own what will happen
Bitcoin,bitcoin   the future,     share   brief story for   readers   that they can learn from   and not make the same mistakes that   almost made which   feel   the single biggest risk   crypto   recently got   new phone and   course traded   old phone   for 100 bucks   whatever they gave   what   didn  realize   that    factor authentication was tied   the old phone   when   went   log into   blockfi account after having   couple   glasses   wine   couldn  get into   account   tried the google authenticator with the new phone and   google account but google gave     error message when   did that   had   use the recovery key that they gave   when   set     account        big deal right before   logs     something pops   with another recovery key which   can  really tell      the same   not   take   picture         safe the next time   log into   account   realize that the old recovery key did not work and that   taking   picture may have been the only thing that saved   from losing all     crypto   withdrew all     crypto from blockfi after this and put     the exchangetraded grayscale trust      discount   nav   avoid becoming   statistic   don  know for sure whether   would have been able   get   crypto back   not    had friends lose hundreds   thousands   dollars   crypto   losing their keys     there    guy   the   who accidentally threw out  over 250 million   bitcoin the new york times profiled   programmer    san francisco who lost over 200 million   bitcoin   well   the second case the guy simply doesn  remember the password there are two sides   this argument the first that when other people lose the keys   their currency that   benefits everyone else and the second   that     could happen   you      ridiculous risk   the end maybe the biggest risk   investing   bitcoin isn  that the price crashes but that something happens   you   you forget your password and lose all your money into cyberspace   anyone here has lost bitcoin and   willing   share please share your story   the comments   believe   readers would benefit from your experience
Bitcoin,  must watch movie about the blockchain,  wellmade moviedocumentary about bitcoin and blockchain   general since the market   kinda sideways and people keep talking about price targets and other irrelevant stuff about this revolutionary tech   yourself   favor and   watch this movie you will get   different perspective about this market and start thinking about this whole     different timeframe imdb cryptopia bitcoin blockchains and the future   the internet  spread knowledge not fud
Bitcoin,low mempool goooooooood,bought btc with   kyc pushed overall 20txscomposed   btc purchases some stored utxo  and node liquidity  and put close     utxos        coinmix  now  the time people
Bitcoin,help free zimbabwe,  guys    got   few questions    like   ask about bitcoin and crypto exchange    from zimbabwe yes the country with trillion dollar notes and      secrete   have   corrupt and dictatorship government hereour currency   worthless and   zimbabweans   cannot shop online   our gvt won  have foreign currency   pay out   zim   here     questions     there   way our government can just create   cryptocurrency exchange and just adopt bitcoin   main currency that way   least   can buy stuff online using bitcoin and they still get their tax   they include     transaction charges     there   way   exchange can   created and run   zimbabwe but   registered with   foreign bank that way our government will not have control for instance can   mexican buy crypto and pay for       american bank   know this   sound like stupid questions but    really like   enlightend   this
Bitcoin,are custom unlocking scripts allowed,previously the utxo unlocking scripts were severely restricted   this still   effect
Bitcoin,friendly reminder,from one day   the next different people are saying    headed for   bear market   preparing for   bull evidence would suggest that none   them know just reminding you all   take everything you read here with   grain   salt recently    seen more people being led astray than being helped   this sub
Bitcoin,rescuing lost bitcoins from   lightning channel,  scenario   don  think    read about before imagine alice opens   lightning channel   bob but then somehow immediately loses her keyspasswords etc the channel show that the entire balance belongs   alice but   there any way without alice  keys for all the money   get recovered   bob    this just   matter   bob broadcasting   normally fraudulent but potentially helpful transaction that spends the money   him without alice publishing   punish transaction   alice didn  consent       she still able   publish   punishing transaction even though that will result   the permanent loss   the coins
Bitcoin, ’  going   lose   bitcoin,‪  need   send  00000400 bitcoin because   bought some games and didn’  have enough and     dont send     don’  get refunded   really hope someone could   kind enough   send that through thanks   much
Bitcoin,  bought   game off joltfun and accidentall sent   little what      ,  now says   have   send   minimum    0001000 satoshi and   dont have that much now   lost all   bitcoin
Bitcoin,its all not true,the real coin   yfi that gonna fly   the moon
Bitcoin,the real revolution,our lives are drastically changing everyday and    gaining momentum… and not   the good waygovernments dictating and enforcing new twisted laws ‘for our own good health’ leaving     choices   trade our freedom for them  mass control and mass surveillance are the real truth and goal behind theses very dangerous measures every smart person know thatfurther     are stepping     total and global digitalised worldwhere everything   controlled   and from the technology     code banking system security system and     …digital euros and other governments cryptocurrencies are   development and soon will   implemented cash will soon disappearthis   our    golden handcuffs where everything will   traced and controlled   the power   placeprivacy   one   biggest right and freedom that any human being   the planet should have  quick exemple when you are having sex with your partner you are closing your windows not because you have   hide something   you are doing something wrong but just because you are protecting your privacy  privacy   freedom now ask yourself  how can   fight back how can   take back our power and freedom not everyone     developer   hacker not everyone can bypass this hightechnology and the power   place   themselves the solution  first   have   look   the root   all problems  the financial banking system printing illimited amount   money and bailing   only the big players leaving the real economy   the dust   the main factor that keeps this corrupted power   place    all know   this planet there   always   cure for any disease and yes this     disease  the cure   cryptocurrency technology and   are now certain that  ’  the most powerful and efficient threat   the entire global financial world order   are still   its early days and   don’  have yet  ’  full potential deployed but   can see already how   affect the central banks having them stating multiple time that they have   urgently regulate cryptocurrencies markets   they will lose their sovereignty some   you are waking   and some resistance groups are forming and especially the mechanics   the future team which are one   the leader   the matter developing   complete anonymous cryptocurrency ecosystem will place every holder and users into   special untouchable position    joining our forces throughout the network   nodes   the upcoming ipro blockchain   insider protocol based   the mimble wimble protocol   will   able   give birth the most unstoppable cryptocurrency ecosystem   the market and   this mean building our safe zone where anyone will   able   take back their freedom and mostly their financial freedomthe more you  going     using decentralized cryptocurrency ecosystem the more   are all going make the old banking financial system disappear and the more   will take back our power and freedom join the real revolution now
Bitcoin,this     strategy has worked well   far,   just looking for opinion and strategy ideas   bought bitcoin   2019 below 10k when   peaked near 60k   sold   third     making some nice profit and put this money into some less volatile assets   the time   writing   basically have bitcoin risk free   the initial investment has been taken out   the markets plus profits now   just got   bank loan roughly 25k which    pay     years      interest rate   figured    have this btc   blockfi getting    and getting more btc with very low risk   btc goes south   have enough money   pay back the loan and liquidate   position what   you guys think   this strategy imo    sound and puts       nice position for the next   years    love   know your opinion
Bitcoin,there   something about this,since there   nothing comparable   btc   like   compare the chartmovements   shitcoins since their buyingmotivations are similar this one right there   uncanny
Bitcoin,how would you rebuttal this argument for ethereum pic inside,   wonderinng what would make bitcoin the better investment given this analogy  formatpjpg autowebp  dab91c25f387aec2228da1cbb516d73351496778
Bitcoin,can someone here verify   the gamestop wallet   legit,background apparently you can mine crypto ethbtc for the gamestop gme wallet this would give   confidence that gamestop actually have   active coin   their nft wallet and their plan     either have crypto based transactions   provide potentially crpyto stock dividends the latter would   good for both crpyto and gme longterm   was thinking this would   the best subreddit   ask   someone would potentially     miner   verify please let   know   this isn  the case    not   miner and wanted   verify what the user said   this post    linked below   legit link  
Bitcoin,where can   download historical price data going back   2010,does anybody know where   can find and download   historical series   bitcoin price that goes back   2010   have only found datasets that start   2013 but   want    create some regression bands and thus   need almost the whole data   think that going back   midlate 2010 will   enough   the dataset had also market cap data that would   great
Bitcoin,bitcoin,armacoin tokens wallet   the total supply   the armacoin gzm tokens   limited    000000000  gzm   now there are 300000000 gzm   circulation the rest are allocated for the mining purpose   means   solar energy sources thereby taking care   the ecology   our planet   the hard cap    380000   the soft cap    000000   the price     gzm equals     usd   dollar   the presentation   our token and the platform   available here   featureyoutu   featureyoutu 
Bitcoin,blockchain viewing,how does one view   monitor the actual blockchain itself view exchanges wallets etc
Bitcoin,  there anywhere   trade   gift cards for bitcoin,  won     gift cards from work both for stores   never shop     was wondering   there     trusted site exchange   directly for bitcoin instead   fiat
Bitcoin,first bitcoin,  finally bought   first bitcoin
Bitcoin,does the difficulty adjustment prorate corrections,  all given the recent difficulty rate adjustment   realized   didn’  quite understand something   will   hard   articulate but here   goes  when the difficulty rate adjustment happens does   compensate for the previous periods slow   fast blocks for example   for   weeks   are solving blocks only every   minutes then   are behind schedule     blocks extreme example does the difficulty adjustment factor this   and set     with   new schedule that will bring     where   should have been   does   just shoot for   minute blocks and hope that the behind schedule periods and the ahead   schedule periods even out part     concern   asking   because   almost always until recently see difficulty adjustments increase… meaning that without   prorated correction mechanism   would consistently   ahead   schedule…   suppose   could   the math and figure   out for myself but   wanted   see   anyone knows
Bitcoin,daily discussion july   2021,please utilize this sticky thread for all general bitcoin discussions   you see posts   the front page    bitcoinnew which are better suited for this daily discussion thread please help out   directing the     this thread instead thank you   you don  get   answer   your question you can try phrasing   differently   commenting again tomorrow join     the  bitcoin chatroom  please check the previous discussion thread  for unanswered questions
Bitcoin,lost bitcoin,    the amount   bitcoin that goes out   circulation     per year from people loosing their wallets   the like   will only     couple decades before the vast majority   bitcoin   out   circulation isn’  that   problem can anyone post links   articles discussing the issue
Bitcoin,bitcoin sent problem,  didn  sent any btc from   trust wallet   this address bc1qag54zlzc55aym4u307nq49uwdew0fna4ee8280 but   shocked   few minutes ago   saw   notification     mobile that   have been sent btc   this  bc1qag54zlzc55aym4u307nq49uwdew0fna4ee8280 address please help   need back   btc  
Bitcoin,bitcoin investment,like     not people want exposure   bitcoin” tilly said believers can bet   its rise and dimon   welcome   take the other side   said “ ’  happy     the ones   the middle”
Bitcoin,  father wants   invest  ,good evening everyone…  ’  fairly new   crypto…   have   bit   background knowledge and what not anyways   father     years old and makes fairly good money …     absolutely clueless with stockscryptocurrency but wants   get his hands into bitcoin particularly even though     aware   knows nothing about stockscrypto   question    should   help him invest   all   bitcoin   now   great time   buy       worth holding     for the long run tips and suggestions are all appreciated
Bitcoin,  avalon 911 good asic for btc mining,  need   know   some one mine bitcoin with canaan avalo 911 can tell     this asic good   avalon 920 better thank you very much
Bitcoin,can   revisit trading satoshi,can   revisit the idea  ’    push for btc     traded   satoshis tell   why this     bad idea here’  why   think  ’    good idea most people are stupid and don’  understand percentage they just see the price seeing   how   smallest unit   bitcoin cost  0003 that would make   seem like   great “deal” and   should see   lot   volume   lot   people still think you need   buy   whole coin
Bitcoin,just   thought about bitcoin   covid…,this may have been brought   here before though   haven’  seen     was just thinking about the bitcoin charts that   all love   stare   and try   predict what’  next   you think that last year’  colossal dip during the march covid selloff has thrown all   these prediction charts out   whack   mean  ’  hard   make   that much selloff   get back into our hopeful future price points
Bitcoin,  transaction fee      satsbyte     real,  made   exchange from fixedfloat and    real   took  351 sat   426 satvbyte   formatpng autowebp  5dbc08eb7ceb01c22e9fc47c27bfa2ed8b755edf
Bitcoin,bitcoin bounce back,when   you guys think bitcoin will bounce back also what   you think will cause     bounce back  
Bitcoin,funfair,how     buy funfair its not   coinbase  thanks
Bitcoin,get bitcoin,get satochi     minutes only important  after you enter your address   bitcoin   chose any amount   btc click claim rewards   complete   offer   prove your not   bot good luck all link   comment
Bitcoin,what hardware wallet would you buy for adults   their early 70s ledger nano     trezor one,good evening fellow bitcoin aficionados   parents want     set     hardware wallet for their bitcoin holdings and they  both   their 70s retired and while they know how   browse the web and use email   their computer their tech skills are about where you would expect them     for folks their age after eliminating some   what   feel     more complex hardware wallets for multiple reasons   have narrowed the choice down   the ledger nano   and the trezor one for those   you with friends parents etc   their 70s what hardware wallet would you set   for them
Bitcoin,   btc     minutes,get    btc     minutes only contact   private first 100 only
Bitcoin,    2300 worth   stocks limited time webull promotion,this promotion       brainer for everyone out there interested   more buying power   buy more crypto   the dip webull     sec registered sipc insured broker     500000   securities insurance known for being the biggest competitor   robinhood and one   the biggest investing apps   the app store they have awesome features and   really beautiful appuser interface   would highly recommend this app   everyone interested   investing they blow robinhood out   the water   every single way possible they have   limited time promotion going   right now register   account with the link below and get   stocks worth     2300 for the first stock you don  need     anything just create   account   claim the second stock you need   deposit   into the account once funds are settled you can claim the stock   you  not interested   investing    still recommend signing   just for the cash you don  even have   use their app you can just sell whatever stocks you get from the promotion when the stock market   open during the week and transfer the money back   your account and then spend with whatever you want   transfer the money   your brokerage   choice  link click here 
Bitcoin,ether,can   talk   lot eth
Bitcoin,under   can   buy   usd bitcoin off someone paypal,  can’  find any sites that don’  require verification and   want   gamble   stake
Bitcoin,     and not the most tech savvy been learning about crypto for the last   months and finally moved   assets     hard wallet thanks   all the posts that helped   smooth brain like myself get   where   need    ,went with the trezor model    very easy   use and setup  thanks again   all the knowledgeable redditor  here
Bitcoin,blockchain account   hold for   months, ’  based     and  ’  signed   for   account with blockchain  ’  invested around 5000 and then   requested the withdrawal blockchain asked   for verification docs  ’  provided   passport driving license and all that was required but blockchain never responded  ’  submitted ticket and blockchain   not even replying   resolving   issue and  ’  been   months  ’  very much dissatisfied   blockchain services   money   stuck from   months which   just insane does anyone   you ever faced such issues with blockchain blockchain accountonhold ticket
