subreddit,post_title,post_content
Bitcoin,are crypto coins the future and   threat   the same time discuss, guys check out this news                         asked about the fed  plans for   digital dollar powell replied “    are the international reserve currency   believe   need   get this right and   don  feel the need     first   fact   already have the pioneering advantage because   have the world  reserve currency ”      the rise   stablecoins stable cryptocurrencies powell stated that there   clearly   demand for currencies and   have been very focused   providing better regulatory responses   potential global stablecoins according   powell studying stablecoins     top priority for the fed   they can become systemically important overnight    now get back here have you ever stopped   imagine this most countries   the world have their international reserves   dollars  brazil for example has 356 billions  news   march 2021 thus     not possible   deny that this     fiat currency that move the world and business     whole   series   concerns thinking here   how     that the health   cryptocurrencies can   maintained   the long term with the main threat being the centralization   central banks and their fiat currencies   the opposite how can central banks enter the decentralized world   cryptos     way that does not undo all the power and underwritten capacity   their fiat currencies      knot   the brain     here comes   number   other things     mind bitcoins for example are finite which would prevent   person from just concentrating all this power for themselves     physical wallet imagine the hardware with all the bitcoins already created   the world  this     rich guy   within digital central banks   your countries     even further would     possible   still have   universal crypto currency   free circulation that has the same power   the dollar has today
Bitcoin,market research with bitcoin traders,calling all   based bitcoin traders betters using sites like betfair paddy power and stock traders   are offering £  for   hour   market research with you doji     new start    the business   buying and selling handsets online and wants   speak with you  please fill out this survey   you are interested   participating  
Bitcoin,the market   favoring traders yesterday   wife bought     33100 for the third time but   fell   31600 last night,the market   favoring traders yesterday   wife bought     33100 for the third time but   fell   31600 last night she was very nervous and asked     needed   sell     loss   didn  say anything she set     sell   32800 before going   bed     result she sold   this morning and the price reached  200   think hodler will win this time     result the price has now returned    600     hodler   was speechless again
Bitcoin,  want   build strikelike app for african market how   get started,      software engineer   want   build   lightening network platform such   strike for the african market   sincerely don  know where   start from   the partnership   engage with   have this achieved family members can send money from     wherever  their accounts   card will   debited and converted   btc wired via lightening network   nigeria and   swap back   ngn and have the receiver credited   ngn nigeria  local currency  what partnerships     need   have this achieved remittance     big chunk   revenue   nigeria and most   money are lost   fees from payment gateways   how     solve this problem using lightening network   what partnerships     need   achieve this
Bitcoin,are   cards reliable for storing bitcoin offline,  was thinking     safe way   securely and discreetly save   bitcoins and   was wondering     cards would     reliable option for this
Bitcoin,  you guys think that quantum computing will eventually destroy block chain,when you really think about   quantum computingresistance can destroy block chain technology  your thoughts
Bitcoin,outline   the basics   cryptocurrency,please let   know     should  arrange change remove any topic   subject any criticism   appreciated brief history   cryptography 500 years ago  cryptology with messages  how cryptology   used   transaction simple definition   cryptocurrency  exchange money with words  banning cryptocurrency   banning speech depending   banks  funds replaced   stolen  freezing funds for   reason  julian assane being sanctioned explaining how cryptocurrencies are borderless  access   blockchain    middleman  connect   any node anywhere   the world governments attempting   prevent       government crackdown  comparing the   dollar   cryptocurrency adoption   cryptocurrency  story   bitcoin pizza  direct purchase   goods for crypto   ultimate adoption centralized exchanges  weakest link  exchanges stealing coins  exchanges cooperating with third parties governments decentralized exchanges the future  tools for pop   exchanges  review systems and reputations stable coins   openly manipulated  obvious scam  method they use   scam cryptocurrency market   stock market  only       stock market   cryptocurrency        short fall     and possible    huge potential         stock market bitcoin birth  attempting     like cash online wallets  defining what   wallet    public and private keys evaluating   crypto project  the importance   analysis  how crypto projects cut corners  spot pump and dump step one  find announement page  review announcement page step two  confirm fair launch step three  check demand  make sure people are using the coin explaining forks and clones step four  check for community growth explain mining profits and equipment tokens  defining what   token   creating your own token    through the process   creating your own token   how   create nft market cap  formula   determine market cap  how market cap can   manipulated where   find cryptocurrency projects  bitcoin talk  exchanges  proof   work pos other proofs explaination
Bitcoin,orignal post    xcryptoguru  exposed tesla lost its carbon credits market   europe      trying   create   renewable credits market   attacking bitcoin mining,    going   try   explain elon musk  seemingly big brain but actually pretty dumb gambit with regards   bitcoin mining note carefully the dates   each development   the story why did tesla buy    billion worth   bitcoin couple   factors  one shortterm and one longterm shortterm play  tesla  production was halted due   supply chain effects from the pandemic this   why there has been   lot   delivery delays this year this meant that tesla  shrinking profits from selling carbon credits   other carmakers alone wasn  enough   post   profitable quarter   tesla decided   buy bitcoin and then sell some     before the end   the quarter   make   for the shortfall bitcoin purchase ensured profitable   2021 for tesla  formatpng autowebp  8f26f8d68c1e3d87def0783972627696905d5368 longterm play  the reason for tesla  revenue from carbon credits sales shrinking   that european carmakers are shifting focus     themselves meaning they   longer need   purchase credits from tesla   comply with strict emissions regulations   the   2020 was tesla  firstever netpositive year thanks   soaring carbon credits sales  formatpng autowebp  821d0344237233cc0322cf0daa03bb0c0282e66f but that source   revenue   now shrinking may    formatpng autowebp  b4121b24c5321d3530eb4e306d0da98193446a3f   tesla now needs   make   for this potentially permanent revenue loss what   they   one day before elon musk tweeted that tesla would   longer accept bitcoin payments due   rapidly increasing use   fossil fuels for bitcoin mining and transactions tesla applied for renewable credits certificate from the epa tesla applied for renewable credits one day before bitcoin mining fud may    formatpng autowebp  d3a8106383a5b92051bde86f2136fdcc5f2932ab unlike carbon credits the epa  renewable credits can   sold   the open market   any industry elon figured   could create   new renewable credits market out   bitcoin mining too bad for elon bitcoin mining uses   higher than the average share   renewables   the     the dumbest part   all this has     the use   and transactions because   incremental energy   used for transactions this guy frankly has zero understanding   how bitcoin works personally   don  think   cares   understand notice how    trying   hijack dog coin and turn   into paypal bitcoin does not benefit beneficiaries   the fiat pyramid scheme taxdodging billionaires who get free money from the government making the rest   our money worth less are   the top   the pyramid and they  loving   credit itruth84 billionaires reap all the benefits from inflation all the ill effects are dumped      formatpng autowebp  baf557f19b9a2c939b1dc4b6b2f66db4143f23d7 edit  sources cited linked below bitcoin purchase made sure tesla had   profitable   2021  2020 was tesla  firstever netpositive year thanks   carbon credits sales  but that source   revenue   shrinking  tesla applied for renewable credits one day before bitcoin fud tweet  credits    xcryptoguru  very well written and informative
Bitcoin,testnet btc need urgent ,  can someone send   some testnet btc   need around 1tbtc   will use   for developing   blockchain application and after around   weeks   will send them back   the wallet from where   got them thanks  address mys2dwmekqgzdm2rxj93rtzjxkbrrm6mre
Bitcoin,why did segwit2x not activate   over     minersnodes were signalling for  ,  just recently read that      bitcoin miners and nodes were signalling for the segwit2x hard fork but then   saw   never went through what happened and why didn      through
Bitcoin,  dca    the top   bought dips,whats your strategy right now   have been stacking sats  are   still dipping   have already held   falling knife    not selling
Bitcoin,people investing   blockchain increased rapidly,posting here for advice and   learn something too     worth all the investment what experience have you had with blockchain technology     worth all the investment
Bitcoin,started   btc bag,been buying other crypto and have bots running but finally started   investing into btc itself feels sooo good   thought   would   less exciting because   the fraction     coin but  ’  awesome let’  hodl
Bitcoin,safest   person btc transfer,hello someone   craigslist wants   pay     bitcoin which   don  mind just   little weird that someone would give   their bitcoin for some wheels but maybe all his money   there   something whats the safest way   make sure its not   scam and   actually getting btc thank you   advance
Bitcoin,how exactly does   government seize btc and what   they   with   after they’  seized  ,seems like   they can       one person they could       anyone they see fit curious how people could potentially safeguard themselves from this
Bitcoin,just sent btc directly from debit card   cold storage for      fee using strike,  used the strike app   buy   worth   btc sent straight     cold storage wallet and the fee was only   for the onchain transaction     used strike before and    never been this cheap   get   into cold storage like this for   the only fee was   mining fee  anyone know   this   part   their new rollout     don  have access   the bitcoin tab yet
Bitcoin,  more and more transactions happen   the lightning network,won  the fees which miners depend   more and more over time become less  due   less transactions happening  chain   will there always      demand for  chain transactions even when block rewards are getting smaller   this   valid concern       being stupid and worrying about the future too much
Bitcoin,bitcoin network status update wednesday july   2021,status   the bitcoin network     wednesday july   2021       est total bitcoins  756246044971 height 691012 difficulty  363025673659960938 statistics for the past   hours number   blocks mined 160 total bitcoins output amount sent  609104757798 total fees  706345 average time until block found   minutes   seconds estimated hashrate 114238380618164871    current price   834  data provided   smartbitcom   price data provided   coinbasecom         bot   commands    cryptobot  message   creator   source code 
Bitcoin,question for btc holders,hello everyone    having problems   life   wanna know   there any subreddits with bitcoin donations    not asking from users   this community for donations just want   know where   can get help with btc wallet only cuz    from kazakhstan and   can  create gofundme cuz there       country for sign  
Bitcoin,let   ask you something…,why people compare bitcoin   the internet one thing   see   lot   “bitcoin   growing much faster than internet back   the day”   might not     genius but bitcoin   not the same thing right completely different things maybe   you look   the whole crypto market… there are some projects that are trying     social media and stuff like that but not just bitcoin thanks for telling   why you think     true   not have   nice day 
Bitcoin,can blowoff tops still happen   everybody   anticipating them,  feel like this cycle everyone has “figured   out”   terms   how the stock flow pattern repeats with everyone expecting   exponential climb   the end   the cycle followed     sudden plunge and   bear market    everybody knows the secret everybody will try   outsmart     selling early logically that would lead     more ‘rounded’ and premature cycle top like  ’  seen recently  likewise   everyone expects   multi year bear market and opens giant short positions   the same time  ’    recipe for the opposite   come true
Bitcoin,bitcoin node  lighting node,considering setting     btc node with   view   then   lightening node   understand the importance   nodes   the network etc and how   will enable     hold complete custody     btc  ’  reasonably technical but not   coderdeveloper anyone with similar skillset embarked   this journey  and how was   and how    
Bitcoin,  don’  understand why   transaction won’  confirm,half empty blocks are being mined but still   transaction      sats pvb   still not being confirmed anybody know why 
Bitcoin,yeah,client wants   pay   btc how   keep the price 400eur   btc
Bitcoin,  there any good company that can “forbid” people from buying bitcoin please leave your reviews   you  tried any,help    looking for the best platform   buy bitcoin please post   url that provides evidence that there   any validity   this question  thanks
Bitcoin,  can try,feel free   send   some bitcoins kappa  
Bitcoin,any good place   keep bitcoins,  guys   used   have   account   xapo but    closing now     need   move   savings   another place any service similar   xapo that you guys recommend   don  have too much but   still want   keep    thanks   advance
Bitcoin,capitalism,  bitcoiners support capitalism   capitalism good   bad
Bitcoin,why   many here like this youtuber     just keeps spreading fud that bitcoin   about   crash but never happens     missing something,  his name   herman pablo    heard some here say that his predictions are accurate     started following him   few weeks ago but his videos are just fuding bitcoin and predicting   every video that bitcoin   about   crash and everybody upvoting his videos what     missing even      jus comedyparody    not even funny
Bitcoin,according     model the bull run   not over     called onefifth model and has strong fundamentals   s2f model  lol 2013   calling   hitting   2017   calling 100k hitting 20k 2021   calling 600k hitting 120k  programmed,nowadays you can see lots   irrelevant models this   one   them
Bitcoin,looking for   bank who   bitcoin friendly,converted the traditional ira     roth ira and paid the taxes check found   self directed ira custodian and transfered   roth   them check had   checkbook corporation drawn   and registered   with the state check tried   open   checking account with axos bank fail they told   that they have   policy that won  allow trading   crypto    asked him why     too risky   had searched the internet for bitcoin friendly banks and their name came     the top   couple times   does this sound like   might have just drawn the wrong person   the wrong day       correct that axos bank doesn  allow trading   crypto   when   filled out the application    explained the purpose and intent   the corp   well   the purpose    intention       fully above board has anyone done   similar thing can you recommend   bank that would allow     invest   money   the assets   wish
Bitcoin,tokenpad network,this   the best project   would like   talk about one   the best project   very promising project this project will   able     much further   hope this project   will   success
Bitcoin,bitcoin helped   continue business when traditional payment options failed,long story short square mistakenly shut down our payment processing ability    tried for over   month   fix the issue with them but their customer service department was terrible and they were were unable   speak with any actual humans   resolve this issue  eventually our “privilege”   continue business was restored   felt   had   try something else     turned   coinbase commerce and were able   start receiving bitcoin   payment within just   minutes    was super easy too and didn’  require any   the lengthy vetting processes associated with fiat based systems like square   bitcoin   the future and   think few people understand how revolutionary this technology   for  commerce
Bitcoin,can steelaluminium cards survive house fires,hey fellas its been   long time coming and finally moving the funds from   exchange onto   hardware wallet but also thinking about ordering   few metal cards   stamp some phrases    just wondering   touch wood and god bless should   place ever       utter and complete flames will   actually survive the ordeal      done research and some places advocate their products   have such durability but compelling evidence states otherwise that aluminium melts   600 degrees celsius while the heat from   house fire can range from anywhere between 6001600 celsius  anyone ever hold   blow torch   one   those   have any personal experience with these
Bitcoin,5000 btc     given away,5000 btc     given away    visite site —  muskgiftingcom     join fast places are limited
Bitcoin,are banks known   block transactions regarding hardware wallet purchases,  tried   place   order for   hardware wallet trezor model     that   can lock   bitcoin into cold storage and     surprise   bank was like proccesi naaah actually fuck you   this   known issue among other torontodominion bank customers
Bitcoin,bit,love     guess
Bitcoin,staking bitcoin where,hello   you all   the title says   wonder where   can stake   btc   get the most out   them and how much would that   thanks   advance
Bitcoin,how can crypto fail,who can cause the failure   crypto currencies     opinion investors themselves the original idea   crypto currencies are   replace fiat currencies for transactions right now everyone   using crypto     investment not     currency for transaction people are investing   the idea   getting rich quick and selling  back   fiat and use fiat for everyday transactions this buying and selling   crypto currencies make   extremely volatile making   not   great asset for every day transactions   the end fiat currencies win inorder for crypto   win people need   use   for their true purpose which       currency which means people buying crypto and using   for transactions which means transferring crypto from one wallet   another and not selling   making crypto stable and can   successful longterm
Bitcoin,can bitcoins get destroyed,how safe   the blockchain     world government arose and took total control   the internet could they destroy bitcoins would     possible another scenario bitcoins gets banned   the government   internet     combination with   social credit score gets required   access the internet which would block ones access   the internet would the bitcoins   safe   spite     access   would     possible for the government   locate the bitcoins and get them destroyed  what   bitcoins got banned   the government what consequences would that have this     reference   cold storage  thank you guys
Bitcoin,    not understand…,  like looking   the btc price ticker just for fun and   not understand why   the price   increasing then you see that someone   accepting   sell for   lower price…  there are individuals buying     higher price why would you put   sell order for   lower price sorry         stupid question but     trying   understand this whole btc universe
Bitcoin,nottheonion   29yo bitcoin billionaire named bankmanfried said   may buy goldman sachs,  sam bankmanfried the ceo   crypto exchange ftx said     interview with the financial times that acquiring goldman sachs   cme group was not out   the question should ftx grow big enough          are the biggest exchange buying goldman   cme   not out   the question   all bankmanfried told the    
Bitcoin, ’  curious   see what the sentiment change will   like   this subreddit when   are hitting ath again, ’  guessing all the nay sayers will change sides
Bitcoin,marketing   new cryptocurrency token,what   the marketing strategy for   cryptocurrency token   have create   few tokens and have been trying   market them with thousands   rugpulls everyday     really hard also you can not use traditional ads etc what   you guys suggest
Bitcoin,  lightning wallet that allows small sat transactions,greetings all   have just started   the world   crypto after   little bit   research over the past week     and wanted   ask the community   there     lightning wallet that allows its users   receive small amounts   sat the one that   started using phoenix requires the first inbound transaction       least  000 sat  your input would   highly appreciated
Bitcoin,bitcoin mining and the environment,energy harbor corp agreed      year arrangement with standard power   establish   environmentally friendly bitcoin mining operation   ohio  the quest for alternative sustainable bitcoin mining solutions accelerated after tesla ceo elon musk declared that his firm will   longer accept bitcoin payments according   the environmental consequences        see companies are divided whether btc   environmental friendly   not what  are your opinions about that
Bitcoin,what   the lightning network and how does   work,how can   use   and take advantage      ’  always been told bitcoin was not scalable
Bitcoin,what   you all think   cex    kraken better,   trying   pick   reliable exchange but  all   them have terrible reviews last time   asked reddit they recommended kraken but kraken also has terrible reviews   trustpilot cex  has good reviews   trust pilot but bad reviews elsewhere    just going   circles trying   pick one
Bitcoin,free midcoin,midoin   the first digital coin that can   mined   your mobile use this link   download the free app   and you will get   boost   you earnings when you use   username issiakadjeme   your invitation code join now and see why everybody   talking about midoin lately
Bitcoin,bitcoin trading volume decreased     june,news   chart  
Bitcoin,grayscale teams   with bny mellon making ready the bitcoin etf,grayscale managing over   billion   digital assets   set   transfer fund account and administration functions for their flagship bitcoin trust   bny mellon   october this   still   line with grayscale  purpose   converting gbtc into   bitcoin etf and bny mellon   dedicated   providing and servicing the growing digital currency asset class grayscale also hopes   getting bitcoin etf approval from   regulators
Bitcoin,when should   buy   hardware wallet,   searched   little about this but   didn  find any good response   the moment   have 500€ invested   crypto which means     want   buy   hardware wallet  €   would   around       investment this seems   lot         would like   ask   what valuepercentage   you guys think     worth     buy   hardware wallet besides    also not sure   which values should   send   crypto from   exchange   the actual wallet considering all the fees and whatever thank you
Bitcoin,why bitcoin adoption would   good for the environment and make   better world,food for thought hear   out    sure    not the first one thinking about this but     see   bitcoin was the global reserve currency one   the effects   would have   our world   that   would have less junk and useless stuff less plastic less trash and   general people would buy less things and those thing would   things that   really needed    people know they money will worth more over time even      just     little they will not spend     useless stuff that they don  really need that would make entrepreneurers pursue projets and products that are actually useful     least quality and valuable  meaning that eventually production   stupid and useless junk would stop and   time there would     junk     least   much less that   polluting our oceans and environment    basically the result   deflation instead   inflation what are your thoughts would this   one   the results   adoption
Bitcoin,funding   wallet,hello people       just installed bluewallet and   want   fund   with some bitcoin how       that   thanks
Bitcoin,  made   nft，  call   the bitcoin flower,   21s   21s
